{
  "generated_at": "2026-07-09",
  "source_queue_generated_at": "2026-07-08",
  "criteria": {
    "service_seed_candidate": "accessible_toilet=yes, parking=yes, and total score >= 8; output remains review-only before field/source hardening",
    "catalog_candidate": "total score >= 5, but not enough for service seed",
    "field_review_required": "low facility score or missing essential accessibility evidence"
  },
  "summary": {
    "total": 87,
    "by_decision": {
      "service_seed_candidate": 17,
      "catalog_candidate": 54,
      "field_review_required": 16
    },
    "by_priority": {
      "high": 17,
      "medium": 54,
      "low": 16
    },
    "by_category": {
      "rest_area": 21,
      "other": 20,
      "sea": 3,
      "culture": 10,
      "indoor": 24,
      "oreum": 1,
      "experience": 5,
      "forest": 3
    },
    "by_region": {
      "제주시": 62,
      "서귀포시": 25
    }
  },
  "candidates": [
    {
      "draft": {
        "id": "jeju_roadview_4_3_001",
        "name": "제주4.3평화공원",
        "region": "제주시",
        "category": "rest_area",
        "verification_status": "partial"
      },
      "score": 10,
      "decision": "service_seed_candidate",
      "priority": "high",
      "yes_fields": [
        "accessible_toilet",
        "parking",
        "rental_or_assistance",
        "rest_area"
      ],
      "no_fields": [],
      "needs_check_fields": [
        "slope_or_stairs",
        "surface_condition"
      ],
      "unknown_fields": [
        "crowd_level"
      ],
      "strengths": [
        "accessible_toilet_confirmed",
        "parking_confirmed",
        "rental_or_assistance_confirmed",
        "rest_area_confirmed",
        "service_relevant_category:rest_area"
      ],
      "risks": [
        "slope_or_stairs_needs_review",
        "surface_condition_needs_review",
        "crowd_level_unknown"
      ],
      "recommended_action": "서비스 시드 후보 파일에 포함하고, 공식 상세 출처 또는 로드뷰 이미지 검수 후 공개 여부 결정"
    },
    {
      "draft": {
        "id": "jeju_roadview_place_003",
        "name": "제주문예회관",
        "region": "제주시",
        "category": "other",
        "verification_status": "partial"
      },
      "score": 6,
      "decision": "catalog_candidate",
      "priority": "medium",
      "yes_fields": [
        "accessible_toilet",
        "parking",
        "rest_area"
      ],
      "no_fields": [
        "rental_or_assistance"
      ],
      "needs_check_fields": [
        "slope_or_stairs",
        "surface_condition"
      ],
      "unknown_fields": [
        "crowd_level"
      ],
      "strengths": [
        "accessible_toilet_confirmed",
        "parking_confirmed",
        "rest_area_confirmed"
      ],
      "risks": [
        "slope_or_stairs_needs_review",
        "surface_condition_needs_review",
        "crowd_level_unknown",
        "category_refinement_needed"
      ],
      "recommended_action": "장소 카탈로그 후보로 유지하고 상세 접근성 출처 확보 후 카드 승격 검토"
    },
    {
      "draft": {
        "id": "jeju_roadview_place_004",
        "name": "탑동광장",
        "region": "제주시",
        "category": "rest_area",
        "verification_status": "partial"
      },
      "score": 7,
      "decision": "catalog_candidate",
      "priority": "medium",
      "yes_fields": [
        "accessible_toilet",
        "parking"
      ],
      "no_fields": [
        "rental_or_assistance",
        "rest_area"
      ],
      "needs_check_fields": [
        "slope_or_stairs",
        "surface_condition"
      ],
      "unknown_fields": [
        "crowd_level"
      ],
      "strengths": [
        "accessible_toilet_confirmed",
        "parking_confirmed",
        "service_relevant_category:rest_area"
      ],
      "risks": [
        "slope_or_stairs_needs_review",
        "surface_condition_needs_review",
        "crowd_level_unknown"
      ],
      "recommended_action": "장소 카탈로그 후보로 유지하고 상세 접근성 출처 확보 후 카드 승격 검토"
    },
    {
      "draft": {
        "id": "jeju_roadview_place_005",
        "name": "도두사수항",
        "region": "제주시",
        "category": "sea",
        "verification_status": "partial"
      },
      "score": 7,
      "decision": "catalog_candidate",
      "priority": "medium",
      "yes_fields": [
        "accessible_toilet",
        "parking"
      ],
      "no_fields": [
        "rental_or_assistance",
        "rest_area"
      ],
      "needs_check_fields": [
        "slope_or_stairs",
        "surface_condition"
      ],
      "unknown_fields": [
        "crowd_level"
      ],
      "strengths": [
        "accessible_toilet_confirmed",
        "parking_confirmed",
        "service_relevant_category:sea"
      ],
      "risks": [
        "slope_or_stairs_needs_review",
        "surface_condition_needs_review",
        "crowd_level_unknown"
      ],
      "recommended_action": "장소 카탈로그 후보로 유지하고 상세 접근성 출처 확보 후 카드 승격 검토"
    },
    {
      "draft": {
        "id": "jeju_roadview_place_006",
        "name": "어영공원",
        "region": "제주시",
        "category": "rest_area",
        "verification_status": "partial"
      },
      "score": 7,
      "decision": "catalog_candidate",
      "priority": "medium",
      "yes_fields": [
        "accessible_toilet",
        "parking"
      ],
      "no_fields": [
        "rental_or_assistance",
        "rest_area"
      ],
      "needs_check_fields": [
        "slope_or_stairs",
        "surface_condition"
      ],
      "unknown_fields": [
        "crowd_level"
      ],
      "strengths": [
        "accessible_toilet_confirmed",
        "parking_confirmed",
        "service_relevant_category:rest_area"
      ],
      "risks": [
        "slope_or_stairs_needs_review",
        "surface_condition_needs_review",
        "crowd_level_unknown"
      ],
      "recommended_action": "장소 카탈로그 후보로 유지하고 상세 접근성 출처 확보 후 카드 승격 검토"
    },
    {
      "draft": {
        "id": "jeju_roadview_place_007",
        "name": "용두암",
        "region": "제주시",
        "category": "other",
        "verification_status": "partial"
      },
      "score": 5,
      "decision": "catalog_candidate",
      "priority": "medium",
      "yes_fields": [
        "accessible_toilet",
        "parking"
      ],
      "no_fields": [
        "rental_or_assistance",
        "rest_area"
      ],
      "needs_check_fields": [
        "slope_or_stairs",
        "surface_condition"
      ],
      "unknown_fields": [
        "crowd_level"
      ],
      "strengths": [
        "accessible_toilet_confirmed",
        "parking_confirmed"
      ],
      "risks": [
        "slope_or_stairs_needs_review",
        "surface_condition_needs_review",
        "crowd_level_unknown",
        "category_refinement_needed"
      ],
      "recommended_action": "장소 카탈로그 후보로 유지하고 상세 접근성 출처 확보 후 카드 승격 검토"
    },
    {
      "draft": {
        "id": "jeju_roadview_place_008",
        "name": "용연구름다리산책로",
        "region": "제주시",
        "category": "rest_area",
        "verification_status": "partial"
      },
      "score": 3,
      "decision": "field_review_required",
      "priority": "low",
      "yes_fields": [
        "accessible_toilet"
      ],
      "no_fields": [
        "parking",
        "rental_or_assistance",
        "rest_area"
      ],
      "needs_check_fields": [
        "slope_or_stairs",
        "surface_condition"
      ],
      "unknown_fields": [
        "crowd_level"
      ],
      "strengths": [
        "accessible_toilet_confirmed",
        "service_relevant_category:rest_area"
      ],
      "risks": [
        "parking_not_confirmed",
        "slope_or_stairs_needs_review",
        "surface_condition_needs_review",
        "crowd_level_unknown"
      ],
      "recommended_action": "현장 동선 또는 공식 접근성 상세 출처 확보 전 서비스 카드 승격 보류"
    },
    {
      "draft": {
        "id": "jeju_roadview_place_010",
        "name": "제주삼양동유적",
        "region": "제주시",
        "category": "culture",
        "verification_status": "partial"
      },
      "score": 9,
      "decision": "service_seed_candidate",
      "priority": "high",
      "yes_fields": [
        "accessible_toilet",
        "parking",
        "rental_or_assistance"
      ],
      "no_fields": [
        "rest_area"
      ],
      "needs_check_fields": [
        "slope_or_stairs",
        "surface_condition"
      ],
      "unknown_fields": [
        "crowd_level"
      ],
      "strengths": [
        "accessible_toilet_confirmed",
        "parking_confirmed",
        "rental_or_assistance_confirmed",
        "service_relevant_category:culture"
      ],
      "risks": [
        "slope_or_stairs_needs_review",
        "surface_condition_needs_review",
        "crowd_level_unknown"
      ],
      "recommended_action": "서비스 시드 후보 파일에 포함하고, 공식 상세 출처 또는 로드뷰 이미지 검수 후 공개 여부 결정"
    },
    {
      "draft": {
        "id": "jeju_roadview_place_011",
        "name": "산지천갤러리,산짓물공원",
        "region": "제주시",
        "category": "rest_area",
        "verification_status": "partial"
      },
      "score": 7,
      "decision": "catalog_candidate",
      "priority": "medium",
      "yes_fields": [
        "accessible_toilet",
        "parking"
      ],
      "no_fields": [
        "rental_or_assistance",
        "rest_area"
      ],
      "needs_check_fields": [
        "slope_or_stairs",
        "surface_condition"
      ],
      "unknown_fields": [
        "crowd_level"
      ],
      "strengths": [
        "accessible_toilet_confirmed",
        "parking_confirmed",
        "service_relevant_category:rest_area"
      ],
      "risks": [
        "slope_or_stairs_needs_review",
        "surface_condition_needs_review",
        "crowd_level_unknown"
      ],
      "recommended_action": "장소 카탈로그 후보로 유지하고 상세 접근성 출처 확보 후 카드 승격 검토"
    },
    {
      "draft": {
        "id": "jeju_roadview_place_013",
        "name": "제주민속자연사박물관",
        "region": "제주시",
        "category": "indoor",
        "verification_status": "partial"
      },
      "score": 10,
      "decision": "service_seed_candidate",
      "priority": "high",
      "yes_fields": [
        "accessible_toilet",